No.     Time           Source                Destination           Protocol Length Info
    224 4.537140007    10.150.33.173         172.17.1.2            DNS      85     Standard query 0x22c4 A ntp.ubuntu.com OPT

Frame 224: 85 bytes on wire (680 bits), 85 bytes captured (680 bits) on interface 0
Ethernet II, Src: LiteonTe_6c:14:2d (3c:a0:67:6c:14:2d), Dst: Cisco_d9:f7:c0 (00:25:b4:d9:f7:c0)
    Destination: Cisco_d9:f7:c0 (00:25:b4:d9:f7:c0)
    Source: LiteonTe_6c:14:2d (3c:a0:67:6c:14:2d)
    Type: IPv4 (0x0800)
Internet Protocol Version 4, Src: 10.150.33.173, Dst: 172.17.1.2
    0100 .... = Version: 4
    .... 0101 = Header Length: 20 bytes (5)
    Differentiated Services Field: 0x00 (DSCP: CS0, ECN: Not-ECT)
    Total Length: 71
    Identification: 0xd01c (53276)
    Flags: 0x4000, Don't fragment
    ...0 0000 0000 0000 = Fragment offset: 0
    Time to live: 64
    Protocol: UDP (17)
    Header checksum: 0x9133 [validation disabled]
    [Header checksum status: Unverified]
    Source: 10.150.33.173
    Destination: 172.17.1.2
User Datagram Protocol, Src Port: 54909, Dst Port: 53
    Source Port: 54909
    Destination Port: 53
    Length: 51
    Checksum: 0xd99a [unverified]
    [Checksum Status: Unverified]
    [Stream index: 49]
    [Timestamps]
Domain Name System (query)
    Transaction ID: 0x22c4
    Flags: 0x0100 Standard query
    Questions: 1
    Answer RRs: 0
    Authority RRs: 0
    Additional RRs: 1
    Queries
    Additional records
    [Response In: 226]

No.     Time           Source                Destination           Protocol Length Info
    225 4.537430502    10.150.33.173         172.17.1.2            DNS      85     Standard query 0xbd6e AAAA ntp.ubuntu.com OPT

Frame 225: 85 bytes on wire (680 bits), 85 bytes captured (680 bits) on interface 0
Ethernet II, Src: LiteonTe_6c:14:2d (3c:a0:67:6c:14:2d), Dst: Cisco_d9:f7:c0 (00:25:b4:d9:f7:c0)
    Destination: Cisco_d9:f7:c0 (00:25:b4:d9:f7:c0)
    Source: LiteonTe_6c:14:2d (3c:a0:67:6c:14:2d)
    Type: IPv4 (0x0800)
Internet Protocol Version 4, Src: 10.150.33.173, Dst: 172.17.1.2
    0100 .... = Version: 4
    .... 0101 = Header Length: 20 bytes (5)
    Differentiated Services Field: 0x00 (DSCP: CS0, ECN: Not-ECT)
    Total Length: 71
    Identification: 0xd01d (53277)
    Flags: 0x4000, Don't fragment
    ...0 0000 0000 0000 = Fragment offset: 0
    Time to live: 64
    Protocol: UDP (17)
    Header checksum: 0x9132 [validation disabled]
    [Header checksum status: Unverified]
    Source: 10.150.33.173
    Destination: 172.17.1.2
User Datagram Protocol, Src Port: 56816, Dst Port: 53
    Source Port: 56816
    Destination Port: 53
    Length: 51
    Checksum: 0xd99a [unverified]
    [Checksum Status: Unverified]
    [Stream index: 50]
    [Timestamps]
Domain Name System (query)
    Transaction ID: 0xbd6e
    Flags: 0x0100 Standard query
    Questions: 1
    Answer RRs: 0
    Authority RRs: 0
    Additional RRs: 1
    Queries
    Additional records
    [Response In: 227]

No.     Time           Source                Destination           Protocol Length Info
    226 4.541162257    172.17.1.2            10.150.33.173         DNS      149    Standard query response 0x22c4 A ntp.ubuntu.com A 91.189.89.198 A 91.189.94.4 A 91.189.91.157 A 91.189.89.199 OPT

Frame 226: 149 bytes on wire (1192 bits), 149 bytes captured (1192 bits) on interface 0
Ethernet II, Src: Cisco_d9:f7:c0 (00:25:b4:d9:f7:c0), Dst: LiteonTe_6c:14:2d (3c:a0:67:6c:14:2d)
    Destination: LiteonTe_6c:14:2d (3c:a0:67:6c:14:2d)
    Source: Cisco_d9:f7:c0 (00:25:b4:d9:f7:c0)
    Type: IPv4 (0x0800)
Internet Protocol Version 4, Src: 172.17.1.2, Dst: 10.150.33.173
    0100 .... = Version: 4
    .... 0101 = Header Length: 20 bytes (5)
    Differentiated Services Field: 0x00 (DSCP: CS0, ECN: Not-ECT)
    Total Length: 135
    Identification: 0x63f4 (25588)
    Flags: 0x0000
    ...0 0000 0000 0000 = Fragment offset: 0
    Time to live: 63
    Protocol: UDP (17)
    Header checksum: 0x3e1c [validation disabled]
    [Header checksum status: Unverified]
    Source: 172.17.1.2
    Destination: 10.150.33.173
User Datagram Protocol, Src Port: 53, Dst Port: 54909
    Source Port: 53
    Destination Port: 54909
    Length: 115
    Checksum: 0x092e [unverified]
    [Checksum Status: Unverified]
    [Stream index: 49]
    [Timestamps]
Domain Name System (response)
    Transaction ID: 0x22c4
    Flags: 0x8180 Standard query response, No error
    Questions: 1
    Answer RRs: 4
    Authority RRs: 0
    Additional RRs: 1
    Queries
    Answers
    Additional records
    [Request In: 224]
    [Time: 0.004022250 seconds]

No.     Time           Source                Destination           Protocol Length Info
    227 4.541426828    172.17.1.2            10.150.33.173         DNS      141    Standard query response 0xbd6e AAAA ntp.ubuntu.com AAAA 2001:67c:1560:8003::c8 AAAA 2001:67c:1560:8003::c7 OPT

Frame 227: 141 bytes on wire (1128 bits), 141 bytes captured (1128 bits) on interface 0
Ethernet II, Src: Cisco_d9:f7:c0 (00:25:b4:d9:f7:c0), Dst: LiteonTe_6c:14:2d (3c:a0:67:6c:14:2d)
    Destination: LiteonTe_6c:14:2d (3c:a0:67:6c:14:2d)
    Source: Cisco_d9:f7:c0 (00:25:b4:d9:f7:c0)
    Type: IPv4 (0x0800)
Internet Protocol Version 4, Src: 172.17.1.2, Dst: 10.150.33.173
    0100 .... = Version: 4
    .... 0101 = Header Length: 20 bytes (5)
    Differentiated Services Field: 0x00 (DSCP: CS0, ECN: Not-ECT)
    Total Length: 127
    Identification: 0x63f5 (25589)
    Flags: 0x0000
    ...0 0000 0000 0000 = Fragment offset: 0
    Time to live: 63
    Protocol: UDP (17)
    Header checksum: 0x3e23 [validation disabled]
    [Header checksum status: Unverified]
    Source: 172.17.1.2
    Destination: 10.150.33.173
User Datagram Protocol, Src Port: 53, Dst Port: 56816
    Source Port: 53
    Destination Port: 56816
    Length: 107
    Checksum: 0x4d09 [unverified]
    [Checksum Status: Unverified]
    [Stream index: 50]
    [Timestamps]
Domain Name System (response)
    Transaction ID: 0xbd6e
    Flags: 0x8180 Standard query response, No error
    Questions: 1
    Answer RRs: 2
    Authority RRs: 0
    Additional RRs: 1
    Queries
    Answers
    Additional records
    [Request In: 225]
    [Time: 0.003996326 seconds]

No.     Time           Source                Destination           Protocol Length Info
    654 10.093719921   10.150.33.173         172.17.1.2            DNS      89     Standard query 0x87db A dl-web.dropbox.com OPT

Frame 654: 89 bytes on wire (712 bits), 89 bytes captured (712 bits) on interface 0
Ethernet II, Src: LiteonTe_6c:14:2d (3c:a0:67:6c:14:2d), Dst: Cisco_d9:f7:c0 (00:25:b4:d9:f7:c0)
    Destination: Cisco_d9:f7:c0 (00:25:b4:d9:f7:c0)
    Source: LiteonTe_6c:14:2d (3c:a0:67:6c:14:2d)
    Type: IPv4 (0x0800)
Internet Protocol Version 4, Src: 10.150.33.173, Dst: 172.17.1.2
    0100 .... = Version: 4
    .... 0101 = Header Length: 20 bytes (5)
    Differentiated Services Field: 0x00 (DSCP: CS0, ECN: Not-ECT)
    Total Length: 75
    Identification: 0xd30b (54027)
    Flags: 0x4000, Don't fragment
    ...0 0000 0000 0000 = Fragment offset: 0
    Time to live: 64
    Protocol: UDP (17)
    Header checksum: 0x8e40 [validation disabled]
    [Header checksum status: Unverified]
    Source: 10.150.33.173
    Destination: 172.17.1.2
User Datagram Protocol, Src Port: 35829, Dst Port: 53
    Source Port: 35829
    Destination Port: 53
    Length: 55
    Checksum: 0xd99e [unverified]
    [Checksum Status: Unverified]
    [Stream index: 109]
    [Timestamps]
Domain Name System (query)
    Transaction ID: 0x87db
    Flags: 0x0100 Standard query
    Questions: 1
    Answer RRs: 0
    Authority RRs: 0
    Additional RRs: 1
    Queries
    Additional records
    [Response In: 665]

No.     Time           Source                Destination           Protocol Length Info
    665 10.171798555   172.17.1.2            10.150.33.173         DNS      146    Standard query response 0x87db A dl-web.dropbox.com CNAME edge-block-www.dropbox-dns.com A 162.125.82.6 OPT

Frame 665: 146 bytes on wire (1168 bits), 146 bytes captured (1168 bits) on interface 0
Ethernet II, Src: Cisco_d9:f7:c0 (00:25:b4:d9:f7:c0), Dst: LiteonTe_6c:14:2d (3c:a0:67:6c:14:2d)
    Destination: LiteonTe_6c:14:2d (3c:a0:67:6c:14:2d)
    Source: Cisco_d9:f7:c0 (00:25:b4:d9:f7:c0)
    Type: IPv4 (0x0800)
Internet Protocol Version 4, Src: 172.17.1.2, Dst: 10.150.33.173
    0100 .... = Version: 4
    .... 0101 = Header Length: 20 bytes (5)
    Differentiated Services Field: 0x00 (DSCP: CS0, ECN: Not-ECT)
    Total Length: 132
    Identification: 0x6dad (28077)
    Flags: 0x0000
    ...0 0000 0000 0000 = Fragment offset: 0
    Time to live: 63
    Protocol: UDP (17)
    Header checksum: 0x3466 [validation disabled]
    [Header checksum status: Unverified]
    Source: 172.17.1.2
    Destination: 10.150.33.173
User Datagram Protocol, Src Port: 53, Dst Port: 35829
    Source Port: 53
    Destination Port: 35829
    Length: 112
    Checksum: 0x5b13 [unverified]
    [Checksum Status: Unverified]
    [Stream index: 109]
    [Timestamps]
Domain Name System (response)
    Transaction ID: 0x87db
    Flags: 0x8180 Standard query response, No error
    Questions: 1
    Answer RRs: 2
    Authority RRs: 0
    Additional RRs: 1
    Queries
    Answers
    Additional records
    [Request In: 654]
    [Time: 0.078078634 seconds]

No.     Time           Source                Destination           Protocol Length Info
    666 10.172662983   10.150.33.173         162.125.82.6          TCP      74     34944 → 443 [SYN] Seq=0 Win=64240 Len=0 MSS=1460 SACK_PERM=1 TSval=1999417535 TSecr=0 WS=128

Frame 666: 74 bytes on wire (592 bits), 74 bytes captured (592 bits) on interface 0
Ethernet II, Src: LiteonTe_6c:14:2d (3c:a0:67:6c:14:2d), Dst: Cisco_d9:f7:c0 (00:25:b4:d9:f7:c0)
    Destination: Cisco_d9:f7:c0 (00:25:b4:d9:f7:c0)
    Source: LiteonTe_6c:14:2d (3c:a0:67:6c:14:2d)
    Type: IPv4 (0x0800)
Internet Protocol Version 4, Src: 10.150.33.173, Dst: 162.125.82.6
    0100 .... = Version: 4
    .... 0101 = Header Length: 20 bytes (5)
    Differentiated Services Field: 0x00 (DSCP: CS0, ECN: Not-ECT)
    Total Length: 60
    Identification: 0xbdc0 (48576)
    Flags: 0x4000, Don't fragment
    ...0 0000 0000 0000 = Fragment offset: 0
    Time to live: 64
    Protocol: TCP (6)
    Header checksum: 0x5c35 [validation disabled]
    [Header checksum status: Unverified]
    Source: 10.150.33.173
    Destination: 162.125.82.6
Transmission Control Protocol, Src Port: 34944, Dst Port: 443, Seq: 0, Len: 0

No.     Time           Source                Destination           Protocol Length Info
    667 10.174714029   162.125.82.6          10.150.33.173         TCP      74     443 → 34944 [SYN, ACK] Seq=0 Ack=1 Win=18328 Len=0 MSS=1396 SACK_PERM=1 TSval=128736026 TSecr=1999417535 WS=128

Frame 667: 74 bytes on wire (592 bits), 74 bytes captured (592 bits) on interface 0
Ethernet II, Src: Cisco_d9:f7:c0 (00:25:b4:d9:f7:c0), Dst: LiteonTe_6c:14:2d (3c:a0:67:6c:14:2d)
    Destination: LiteonTe_6c:14:2d (3c:a0:67:6c:14:2d)
    Source: Cisco_d9:f7:c0 (00:25:b4:d9:f7:c0)
    Type: IPv4 (0x0800)
Internet Protocol Version 4, Src: 162.125.82.6, Dst: 10.150.33.173
    0100 .... = Version: 4
    .... 0101 = Header Length: 20 bytes (5)
    Differentiated Services Field: 0x00 (DSCP: CS0, ECN: Not-ECT)
    Total Length: 60
    Identification: 0xe7ae (59310)
    Flags: 0x0000
    ...0 0000 0000 0000 = Fragment offset: 0
    Time to live: 63
    Protocol: TCP (6)
    Header checksum: 0x7347 [validation disabled]
    [Header checksum status: Unverified]
    Source: 162.125.82.6
    Destination: 10.150.33.173
Transmission Control Protocol, Src Port: 443, Dst Port: 34944, Seq: 0, Ack: 1, Len: 0

No.     Time           Source                Destination           Protocol Length Info
    668 10.174758950   10.150.33.173         162.125.82.6          TCP      66     34944 → 443 [ACK] Seq=1 Ack=1 Win=64256 Len=0 TSval=1999417538 TSecr=128736026

Frame 668: 66 bytes on wire (528 bits), 66 bytes captured (528 bits) on interface 0
Ethernet II, Src: LiteonTe_6c:14:2d (3c:a0:67:6c:14:2d), Dst: Cisco_d9:f7:c0 (00:25:b4:d9:f7:c0)
    Destination: Cisco_d9:f7:c0 (00:25:b4:d9:f7:c0)
    Source: LiteonTe_6c:14:2d (3c:a0:67:6c:14:2d)
    Type: IPv4 (0x0800)
Internet Protocol Version 4, Src: 10.150.33.173, Dst: 162.125.82.6
    0100 .... = Version: 4
    .... 0101 = Header Length: 20 bytes (5)
    Differentiated Services Field: 0x00 (DSCP: CS0, ECN: Not-ECT)
    Total Length: 52
    Identification: 0xbdc1 (48577)
    Flags: 0x4000, Don't fragment
    ...0 0000 0000 0000 = Fragment offset: 0
    Time to live: 64
    Protocol: TCP (6)
    Header checksum: 0x5c3c [validation disabled]
    [Header checksum status: Unverified]
    Source: 10.150.33.173
    Destination: 162.125.82.6
Transmission Control Protocol, Src Port: 34944, Dst Port: 443, Seq: 1, Ack: 1, Len: 0

No.     Time           Source                Destination           Protocol Length Info
    669 10.175234730   10.150.33.173         162.125.82.6          TLSv1.2  583    Client Hello

Frame 669: 583 bytes on wire (4664 bits), 583 bytes captured (4664 bits) on interface 0
Ethernet II, Src: LiteonTe_6c:14:2d (3c:a0:67:6c:14:2d), Dst: Cisco_d9:f7:c0 (00:25:b4:d9:f7:c0)
    Destination: Cisco_d9:f7:c0 (00:25:b4:d9:f7:c0)
    Source: LiteonTe_6c:14:2d (3c:a0:67:6c:14:2d)
    Type: IPv4 (0x0800)
Internet Protocol Version 4, Src: 10.150.33.173, Dst: 162.125.82.6
    0100 .... = Version: 4
    .... 0101 = Header Length: 20 bytes (5)
    Differentiated Services Field: 0x00 (DSCP: CS0, ECN: Not-ECT)
    Total Length: 569
    Identification: 0xbdc2 (48578)
    Flags: 0x4000, Don't fragment
    ...0 0000 0000 0000 = Fragment offset: 0
    Time to live: 64
    Protocol: TCP (6)
    Header checksum: 0x5a36 [validation disabled]
    [Header checksum status: Unverified]
    Source: 10.150.33.173
    Destination: 162.125.82.6
Transmission Control Protocol, Src Port: 34944, Dst Port: 443, Seq: 1, Ack: 1, Len: 517
Transport Layer Security

No.     Time           Source                Destination           Protocol Length Info
    670 10.176649931   162.125.82.6          10.150.33.173         TCP      66     443 → 34944 [ACK] Seq=1 Ack=518 Win=19456 Len=0 TSval=128736026 TSecr=1999417538

Frame 670: 66 bytes on wire (528 bits), 66 bytes captured (528 bits) on interface 0
Ethernet II, Src: Cisco_d9:f7:c0 (00:25:b4:d9:f7:c0), Dst: LiteonTe_6c:14:2d (3c:a0:67:6c:14:2d)
    Destination: LiteonTe_6c:14:2d (3c:a0:67:6c:14:2d)
    Source: Cisco_d9:f7:c0 (00:25:b4:d9:f7:c0)
    Type: IPv4 (0x0800)
Internet Protocol Version 4, Src: 162.125.82.6, Dst: 10.150.33.173
    0100 .... = Version: 4
    .... 0101 = Header Length: 20 bytes (5)
    Differentiated Services Field: 0x00 (DSCP: CS0, ECN: Not-ECT)
    Total Length: 52
    Identification: 0xe7af (59311)
    Flags: 0x0000
    ...0 0000 0000 0000 = Fragment offset: 0
    Time to live: 63
    Protocol: TCP (6)
    Header checksum: 0x734e [validation disabled]
    [Header checksum status: Unverified]
    Source: 162.125.82.6
    Destination: 10.150.33.173
Transmission Control Protocol, Src Port: 443, Dst Port: 34944, Seq: 1, Ack: 518, Len: 0

No.     Time           Source                Destination           Protocol Length Info
    744 11.264073670   162.125.82.6          10.150.33.173         TLSv1.2  3200   Server Hello, Certificate, Server Key Exchange, Server Hello Done

Frame 744: 3200 bytes on wire (25600 bits), 3200 bytes captured (25600 bits) on interface 0
Ethernet II, Src: Cisco_d9:f7:c0 (00:25:b4:d9:f7:c0), Dst: LiteonTe_6c:14:2d (3c:a0:67:6c:14:2d)
    Destination: LiteonTe_6c:14:2d (3c:a0:67:6c:14:2d)
    Source: Cisco_d9:f7:c0 (00:25:b4:d9:f7:c0)
    Type: IPv4 (0x0800)
Internet Protocol Version 4, Src: 162.125.82.6, Dst: 10.150.33.173
    0100 .... = Version: 4
    .... 0101 = Header Length: 20 bytes (5)
    Differentiated Services Field: 0x00 (DSCP: CS0, ECN: Not-ECT)
    Total Length: 3186
    Identification: 0xe7b0 (59312)
    Flags: 0x0000
    ...0 0000 0000 0000 = Fragment offset: 0
    Time to live: 63
    Protocol: TCP (6)
    Header checksum: 0x670f [validation disabled]
    [Header checksum status: Unverified]
    Source: 162.125.82.6
    Destination: 10.150.33.173
Transmission Control Protocol, Src Port: 443, Dst Port: 34944, Seq: 1, Ack: 518, Len: 3134
Transport Layer Security

No.     Time           Source                Destination           Protocol Length Info
    745 11.264145757   10.150.33.173         162.125.82.6          TCP      66     34944 → 443 [ACK] Seq=518 Ack=3135 Win=61952 Len=0 TSval=1999418627 TSecr=128736116

Frame 745: 66 bytes on wire (528 bits), 66 bytes captured (528 bits) on interface 0
Ethernet II, Src: LiteonTe_6c:14:2d (3c:a0:67:6c:14:2d), Dst: Cisco_d9:f7:c0 (00:25:b4:d9:f7:c0)
    Destination: Cisco_d9:f7:c0 (00:25:b4:d9:f7:c0)
    Source: LiteonTe_6c:14:2d (3c:a0:67:6c:14:2d)
    Type: IPv4 (0x0800)
Internet Protocol Version 4, Src: 10.150.33.173, Dst: 162.125.82.6
    0100 .... = Version: 4
    .... 0101 = Header Length: 20 bytes (5)
    Differentiated Services Field: 0x00 (DSCP: CS0, ECN: Not-ECT)
    Total Length: 52
    Identification: 0xbdc3 (48579)
    Flags: 0x4000, Don't fragment
    ...0 0000 0000 0000 = Fragment offset: 0
    Time to live: 64
    Protocol: TCP (6)
    Header checksum: 0x5c3a [validation disabled]
    [Header checksum status: Unverified]
    Source: 10.150.33.173
    Destination: 162.125.82.6
Transmission Control Protocol, Src Port: 34944, Dst Port: 443, Seq: 518, Ack: 3135, Len: 0

No.     Time           Source                Destination           Protocol Length Info
    746 11.272031234   10.150.33.173         162.125.82.6          TLSv1.2  159    Client Key Exchange, Change Cipher Spec, Encrypted Handshake Message

Frame 746: 159 bytes on wire (1272 bits), 159 bytes captured (1272 bits) on interface 0
Ethernet II, Src: LiteonTe_6c:14:2d (3c:a0:67:6c:14:2d), Dst: Cisco_d9:f7:c0 (00:25:b4:d9:f7:c0)
    Destination: Cisco_d9:f7:c0 (00:25:b4:d9:f7:c0)
    Source: LiteonTe_6c:14:2d (3c:a0:67:6c:14:2d)
    Type: IPv4 (0x0800)
Internet Protocol Version 4, Src: 10.150.33.173, Dst: 162.125.82.6
    0100 .... = Version: 4
    .... 0101 = Header Length: 20 bytes (5)
    Differentiated Services Field: 0x00 (DSCP: CS0, ECN: Not-ECT)
    Total Length: 145
    Identification: 0xbdc4 (48580)
    Flags: 0x4000, Don't fragment
    ...0 0000 0000 0000 = Fragment offset: 0
    Time to live: 64
    Protocol: TCP (6)
    Header checksum: 0x5bdc [validation disabled]
    [Header checksum status: Unverified]
    Source: 10.150.33.173
    Destination: 162.125.82.6
Transmission Control Protocol, Src Port: 34944, Dst Port: 443, Seq: 518, Ack: 3135, Len: 93
Transport Layer Security

No.     Time           Source                Destination           Protocol Length Info
    747 11.272974154   10.150.33.173         162.125.82.6          TLSv1.2  636    Application Data, Application Data

Frame 747: 636 bytes on wire (5088 bits), 636 bytes captured (5088 bits) on interface 0
Ethernet II, Src: LiteonTe_6c:14:2d (3c:a0:67:6c:14:2d), Dst: Cisco_d9:f7:c0 (00:25:b4:d9:f7:c0)
    Destination: Cisco_d9:f7:c0 (00:25:b4:d9:f7:c0)
    Source: LiteonTe_6c:14:2d (3c:a0:67:6c:14:2d)
    Type: IPv4 (0x0800)
Internet Protocol Version 4, Src: 10.150.33.173, Dst: 162.125.82.6
    0100 .... = Version: 4
    .... 0101 = Header Length: 20 bytes (5)
    Differentiated Services Field: 0x00 (DSCP: CS0, ECN: Not-ECT)
    Total Length: 622
    Identification: 0xbdc5 (48581)
    Flags: 0x4000, Don't fragment
    ...0 0000 0000 0000 = Fragment offset: 0
    Time to live: 64
    Protocol: TCP (6)
    Header checksum: 0x59fe [validation disabled]
    [Header checksum status: Unverified]
    Source: 10.150.33.173
    Destination: 162.125.82.6
Transmission Control Protocol, Src Port: 34944, Dst Port: 443, Seq: 611, Ack: 3135, Len: 570
Transport Layer Security

No.     Time           Source                Destination           Protocol Length Info
    748 11.273839113   162.125.82.6          10.150.33.173         TCP      66     443 → 34944 [ACK] Seq=3135 Ack=611 Win=19456 Len=0 TSval=128736136 TSecr=1999418635

Frame 748: 66 bytes on wire (528 bits), 66 bytes captured (528 bits) on interface 0
Ethernet II, Src: Cisco_d9:f7:c0 (00:25:b4:d9:f7:c0), Dst: LiteonTe_6c:14:2d (3c:a0:67:6c:14:2d)
    Destination: LiteonTe_6c:14:2d (3c:a0:67:6c:14:2d)
    Source: Cisco_d9:f7:c0 (00:25:b4:d9:f7:c0)
    Type: IPv4 (0x0800)
Internet Protocol Version 4, Src: 162.125.82.6, Dst: 10.150.33.173
    0100 .... = Version: 4
    .... 0101 = Header Length: 20 bytes (5)
    Differentiated Services Field: 0x00 (DSCP: CS0, ECN: Not-ECT)
    Total Length: 52
    Identification: 0xe7b3 (59315)
    Flags: 0x0000
    ...0 0000 0000 0000 = Fragment offset: 0
    Time to live: 63
    Protocol: TCP (6)
    Header checksum: 0x734a [validation disabled]
    [Header checksum status: Unverified]
    Source: 162.125.82.6
    Destination: 10.150.33.173
Transmission Control Protocol, Src Port: 443, Dst Port: 34944, Seq: 3135, Ack: 611, Len: 0

No.     Time           Source                Destination           Protocol Length Info
    749 11.274147929   162.125.82.6          10.150.33.173         TCP      66     443 → 34944 [ACK] Seq=3135 Ack=1181 Win=20608 Len=0 TSval=128736136 TSecr=1999418636

Frame 749: 66 bytes on wire (528 bits), 66 bytes captured (528 bits) on interface 0
Ethernet II, Src: Cisco_d9:f7:c0 (00:25:b4:d9:f7:c0), Dst: LiteonTe_6c:14:2d (3c:a0:67:6c:14:2d)
    Destination: LiteonTe_6c:14:2d (3c:a0:67:6c:14:2d)
    Source: Cisco_d9:f7:c0 (00:25:b4:d9:f7:c0)
    Type: IPv4 (0x0800)
Internet Protocol Version 4, Src: 162.125.82.6, Dst: 10.150.33.173
    0100 .... = Version: 4
    .... 0101 = Header Length: 20 bytes (5)
    Differentiated Services Field: 0x00 (DSCP: CS0, ECN: Not-ECT)
    Total Length: 52
    Identification: 0xe7b4 (59316)
    Flags: 0x0000
    ...0 0000 0000 0000 = Fragment offset: 0
    Time to live: 63
    Protocol: TCP (6)
    Header checksum: 0x7349 [validation disabled]
    [Header checksum status: Unverified]
    Source: 162.125.82.6
    Destination: 10.150.33.173
Transmission Control Protocol, Src Port: 443, Dst Port: 34944, Seq: 3135, Ack: 1181, Len: 0

No.     Time           Source                Destination           Protocol Length Info
    782 11.673705840   162.125.82.6          10.150.33.173         TLSv1.2  324    New Session Ticket, Change Cipher Spec, Encrypted Handshake Message

Frame 782: 324 bytes on wire (2592 bits), 324 bytes captured (2592 bits) on interface 0
Ethernet II, Src: Cisco_d9:f7:c0 (00:25:b4:d9:f7:c0), Dst: LiteonTe_6c:14:2d (3c:a0:67:6c:14:2d)
    Destination: LiteonTe_6c:14:2d (3c:a0:67:6c:14:2d)
    Source: Cisco_d9:f7:c0 (00:25:b4:d9:f7:c0)
    Type: IPv4 (0x0800)
Internet Protocol Version 4, Src: 162.125.82.6, Dst: 10.150.33.173
    0100 .... = Version: 4
    .... 0101 = Header Length: 20 bytes (5)
    Differentiated Services Field: 0x00 (DSCP: CS0, ECN: Not-ECT)
    Total Length: 310
    Identification: 0xe7b5 (59317)
    Flags: 0x0000
    ...0 0000 0000 0000 = Fragment offset: 0
    Time to live: 63
    Protocol: TCP (6)
    Header checksum: 0x7246 [validation disabled]
    [Header checksum status: Unverified]
    Source: 162.125.82.6
    Destination: 10.150.33.173
Transmission Control Protocol, Src Port: 443, Dst Port: 34944, Seq: 3135, Ack: 1181, Len: 258
Transport Layer Security

No.     Time           Source                Destination           Protocol Length Info
    783 11.673724380   10.150.33.173         162.125.82.6          TCP      66     34944 → 443 [ACK] Seq=1181 Ack=3393 Win=64128 Len=0 TSval=1999419037 TSecr=128736164

Frame 783: 66 bytes on wire (528 bits), 66 bytes captured (528 bits) on interface 0
Ethernet II, Src: LiteonTe_6c:14:2d (3c:a0:67:6c:14:2d), Dst: Cisco_d9:f7:c0 (00:25:b4:d9:f7:c0)
    Destination: Cisco_d9:f7:c0 (00:25:b4:d9:f7:c0)
    Source: LiteonTe_6c:14:2d (3c:a0:67:6c:14:2d)
    Type: IPv4 (0x0800)
Internet Protocol Version 4, Src: 10.150.33.173, Dst: 162.125.82.6
    0100 .... = Version: 4
    .... 0101 = Header Length: 20 bytes (5)
    Differentiated Services Field: 0x00 (DSCP: CS0, ECN: Not-ECT)
    Total Length: 52
    Identification: 0xbdc6 (48582)
    Flags: 0x4000, Don't fragment
    ...0 0000 0000 0000 = Fragment offset: 0
    Time to live: 64
    Protocol: TCP (6)
    Header checksum: 0x5c37 [validation disabled]
    [Header checksum status: Unverified]
    Source: 10.150.33.173
    Destination: 162.125.82.6
Transmission Control Protocol, Src Port: 34944, Dst Port: 443, Seq: 1181, Ack: 3393, Len: 0

No.     Time           Source                Destination           Protocol Length Info
    784 11.673735277   162.125.82.6          10.150.33.173         TLSv1.2  144    Application Data

Frame 784: 144 bytes on wire (1152 bits), 144 bytes captured (1152 bits) on interface 0
Ethernet II, Src: Cisco_d9:f7:c0 (00:25:b4:d9:f7:c0), Dst: LiteonTe_6c:14:2d (3c:a0:67:6c:14:2d)
    Destination: LiteonTe_6c:14:2d (3c:a0:67:6c:14:2d)
    Source: Cisco_d9:f7:c0 (00:25:b4:d9:f7:c0)
    Type: IPv4 (0x0800)
Internet Protocol Version 4, Src: 162.125.82.6, Dst: 10.150.33.173
    0100 .... = Version: 4
    .... 0101 = Header Length: 20 bytes (5)
    Differentiated Services Field: 0x00 (DSCP: CS0, ECN: Not-ECT)
    Total Length: 130
    Identification: 0xe7b6 (59318)
    Flags: 0x0000
    ...0 0000 0000 0000 = Fragment offset: 0
    Time to live: 63
    Protocol: TCP (6)
    Header checksum: 0x72f9 [validation disabled]
    [Header checksum status: Unverified]
    Source: 162.125.82.6
    Destination: 10.150.33.173
Transmission Control Protocol, Src Port: 443, Dst Port: 34944, Seq: 3393, Ack: 1181, Len: 78
Transport Layer Security

No.     Time           Source                Destination           Protocol Length Info
    785 11.673738815   10.150.33.173         162.125.82.6          TCP      66     34944 → 443 [ACK] Seq=1181 Ack=3471 Win=64128 Len=0 TSval=1999419037 TSecr=128736164

Frame 785: 66 bytes on wire (528 bits), 66 bytes captured (528 bits) on interface 0
Ethernet II, Src: LiteonTe_6c:14:2d (3c:a0:67:6c:14:2d), Dst: Cisco_d9:f7:c0 (00:25:b4:d9:f7:c0)
    Destination: Cisco_d9:f7:c0 (00:25:b4:d9:f7:c0)
    Source: LiteonTe_6c:14:2d (3c:a0:67:6c:14:2d)
    Type: IPv4 (0x0800)
Internet Protocol Version 4, Src: 10.150.33.173, Dst: 162.125.82.6
    0100 .... = Version: 4
    .... 0101 = Header Length: 20 bytes (5)
    Differentiated Services Field: 0x00 (DSCP: CS0, ECN: Not-ECT)
    Total Length: 52
    Identification: 0xbdc7 (48583)
    Flags: 0x4000, Don't fragment
    ...0 0000 0000 0000 = Fragment offset: 0
    Time to live: 64
    Protocol: TCP (6)
    Header checksum: 0x5c36 [validation disabled]
    [Header checksum status: Unverified]
    Source: 10.150.33.173
    Destination: 162.125.82.6
Transmission Control Protocol, Src Port: 34944, Dst Port: 443, Seq: 1181, Ack: 3471, Len: 0

No.     Time           Source                Destination           Protocol Length Info
    786 11.673935274   10.150.33.173         162.125.82.6          TLSv1.2  104    Application Data

Frame 786: 104 bytes on wire (832 bits), 104 bytes captured (832 bits) on interface 0
Ethernet II, Src: LiteonTe_6c:14:2d (3c:a0:67:6c:14:2d), Dst: Cisco_d9:f7:c0 (00:25:b4:d9:f7:c0)
    Destination: Cisco_d9:f7:c0 (00:25:b4:d9:f7:c0)
    Source: LiteonTe_6c:14:2d (3c:a0:67:6c:14:2d)
    Type: IPv4 (0x0800)
Internet Protocol Version 4, Src: 10.150.33.173, Dst: 162.125.82.6
    0100 .... = Version: 4
    .... 0101 = Header Length: 20 bytes (5)
    Differentiated Services Field: 0x00 (DSCP: CS0, ECN: Not-ECT)
    Total Length: 90
    Identification: 0xbdc8 (48584)
    Flags: 0x4000, Don't fragment
    ...0 0000 0000 0000 = Fragment offset: 0
    Time to live: 64
    Protocol: TCP (6)
    Header checksum: 0x5c0f [validation disabled]
    [Header checksum status: Unverified]
    Source: 10.150.33.173
    Destination: 162.125.82.6
Transmission Control Protocol, Src Port: 34944, Dst Port: 443, Seq: 1181, Ack: 3471, Len: 38
Transport Layer Security

No.     Time           Source                Destination           Protocol Length Info
    787 11.675423670   162.125.82.6          10.150.33.173         TCP      66     443 → 34944 [ACK] Seq=3471 Ack=1219 Win=20608 Len=0 TSval=128736176 TSecr=1999419037

Frame 787: 66 bytes on wire (528 bits), 66 bytes captured (528 bits) on interface 0
Ethernet II, Src: Cisco_d9:f7:c0 (00:25:b4:d9:f7:c0), Dst: LiteonTe_6c:14:2d (3c:a0:67:6c:14:2d)
    Destination: LiteonTe_6c:14:2d (3c:a0:67:6c:14:2d)
    Source: Cisco_d9:f7:c0 (00:25:b4:d9:f7:c0)
    Type: IPv4 (0x0800)
Internet Protocol Version 4, Src: 162.125.82.6, Dst: 10.150.33.173
    0100 .... = Version: 4
    .... 0101 = Header Length: 20 bytes (5)
    Differentiated Services Field: 0x00 (DSCP: CS0, ECN: Not-ECT)
    Total Length: 52
    Identification: 0xe7b7 (59319)
    Flags: 0x0000
    ...0 0000 0000 0000 = Fragment offset: 0
    Time to live: 63
    Protocol: TCP (6)
    Header checksum: 0x7346 [validation disabled]
    [Header checksum status: Unverified]
    Source: 162.125.82.6
    Destination: 10.150.33.173
Transmission Control Protocol, Src Port: 443, Dst Port: 34944, Seq: 3471, Ack: 1219, Len: 0

No.     Time           Source                Destination           Protocol Length Info
    788 11.809351121   162.125.82.6          10.150.33.173         TLSv1.2  921    Application Data

Frame 788: 921 bytes on wire (7368 bits), 921 bytes captured (7368 bits) on interface 0
Ethernet II, Src: Cisco_d9:f7:c0 (00:25:b4:d9:f7:c0), Dst: LiteonTe_6c:14:2d (3c:a0:67:6c:14:2d)
    Destination: LiteonTe_6c:14:2d (3c:a0:67:6c:14:2d)
    Source: Cisco_d9:f7:c0 (00:25:b4:d9:f7:c0)
    Type: IPv4 (0x0800)
Internet Protocol Version 4, Src: 162.125.82.6, Dst: 10.150.33.173
    0100 .... = Version: 4
    .... 0101 = Header Length: 20 bytes (5)
    Differentiated Services Field: 0x00 (DSCP: CS0, ECN: Not-ECT)
    Total Length: 907
    Identification: 0xe7b8 (59320)
    Flags: 0x0000
    ...0 0000 0000 0000 = Fragment offset: 0
    Time to live: 63
    Protocol: TCP (6)
    Header checksum: 0x6fee [validation disabled]
    [Header checksum status: Unverified]
    Source: 162.125.82.6
    Destination: 10.150.33.173
Transmission Control Protocol, Src Port: 443, Dst Port: 34944, Seq: 3471, Ack: 1219, Len: 855
Transport Layer Security

No.     Time           Source                Destination           Protocol Length Info
    789 11.809399475   10.150.33.173         162.125.82.6          TCP      66     34944 → 443 [ACK] Seq=1219 Ack=4326 Win=64128 Len=0 TSval=1999419172 TSecr=128736189

Frame 789: 66 bytes on wire (528 bits), 66 bytes captured (528 bits) on interface 0
Ethernet II, Src: LiteonTe_6c:14:2d (3c:a0:67:6c:14:2d), Dst: Cisco_d9:f7:c0 (00:25:b4:d9:f7:c0)
    Destination: Cisco_d9:f7:c0 (00:25:b4:d9:f7:c0)
    Source: LiteonTe_6c:14:2d (3c:a0:67:6c:14:2d)
    Type: IPv4 (0x0800)
Internet Protocol Version 4, Src: 10.150.33.173, Dst: 162.125.82.6
    0100 .... = Version: 4
    .... 0101 = Header Length: 20 bytes (5)
    Differentiated Services Field: 0x00 (DSCP: CS0, ECN: Not-ECT)
    Total Length: 52
    Identification: 0xbdc9 (48585)
    Flags: 0x4000, Don't fragment
    ...0 0000 0000 0000 = Fragment offset: 0
    Time to live: 64
    Protocol: TCP (6)
    Header checksum: 0x5c34 [validation disabled]
    [Header checksum status: Unverified]
    Source: 10.150.33.173
    Destination: 162.125.82.6
Transmission Control Protocol, Src Port: 34944, Dst Port: 443, Seq: 1219, Ack: 4326, Len: 0

No.     Time           Source                Destination           Protocol Length Info
    790 11.831992919   10.150.33.173         162.125.82.6          TCP      74     34946 → 443 [SYN] Seq=0 Win=64240 Len=0 MSS=1460 SACK_PERM=1 TSval=1999419195 TSecr=0 WS=128

Frame 790: 74 bytes on wire (592 bits), 74 bytes captured (592 bits) on interface 0
Ethernet II, Src: LiteonTe_6c:14:2d (3c:a0:67:6c:14:2d), Dst: Cisco_d9:f7:c0 (00:25:b4:d9:f7:c0)
    Destination: Cisco_d9:f7:c0 (00:25:b4:d9:f7:c0)
    Source: LiteonTe_6c:14:2d (3c:a0:67:6c:14:2d)
    Type: IPv4 (0x0800)
Internet Protocol Version 4, Src: 10.150.33.173, Dst: 162.125.82.6
    0100 .... = Version: 4
    .... 0101 = Header Length: 20 bytes (5)
    Differentiated Services Field: 0x00 (DSCP: CS0, ECN: Not-ECT)
    Total Length: 60
    Identification: 0xcc5a (52314)
    Flags: 0x4000, Don't fragment
    ...0 0000 0000 0000 = Fragment offset: 0
    Time to live: 64
    Protocol: TCP (6)
    Header checksum: 0x4d9b [validation disabled]
    [Header checksum status: Unverified]
    Source: 10.150.33.173
    Destination: 162.125.82.6
Transmission Control Protocol, Src Port: 34946, Dst Port: 443, Seq: 0, Len: 0

No.     Time           Source                Destination           Protocol Length Info
    791 11.835905964   162.125.82.6          10.150.33.173         TCP      74     443 → 34946 [SYN, ACK] Seq=0 Ack=1 Win=18328 Len=0 MSS=1396 SACK_PERM=1 TSval=128736192 TSecr=1999419195 WS=128

Frame 791: 74 bytes on wire (592 bits), 74 bytes captured (592 bits) on interface 0
Ethernet II, Src: Cisco_d9:f7:c0 (00:25:b4:d9:f7:c0), Dst: LiteonTe_6c:14:2d (3c:a0:67:6c:14:2d)
    Destination: LiteonTe_6c:14:2d (3c:a0:67:6c:14:2d)
    Source: Cisco_d9:f7:c0 (00:25:b4:d9:f7:c0)
    Type: IPv4 (0x0800)
Internet Protocol Version 4, Src: 162.125.82.6, Dst: 10.150.33.173
    0100 .... = Version: 4
    .... 0101 = Header Length: 20 bytes (5)
    Differentiated Services Field: 0x00 (DSCP: CS0, ECN: Not-ECT)
    Total Length: 60
    Identification: 0xe7b9 (59321)
    Flags: 0x0000
    ...0 0000 0000 0000 = Fragment offset: 0
    Time to live: 63
    Protocol: TCP (6)
    Header checksum: 0x733c [validation disabled]
    [Header checksum status: Unverified]
    Source: 162.125.82.6
    Destination: 10.150.33.173
Transmission Control Protocol, Src Port: 443, Dst Port: 34946, Seq: 0, Ack: 1, Len: 0

No.     Time           Source                Destination           Protocol Length Info
    792 11.835991309   10.150.33.173         162.125.82.6          TCP      66     34946 → 443 [ACK] Seq=1 Ack=1 Win=64256 Len=0 TSval=1999419199 TSecr=128736192

Frame 792: 66 bytes on wire (528 bits), 66 bytes captured (528 bits) on interface 0
Ethernet II, Src: LiteonTe_6c:14:2d (3c:a0:67:6c:14:2d), Dst: Cisco_d9:f7:c0 (00:25:b4:d9:f7:c0)
    Destination: Cisco_d9:f7:c0 (00:25:b4:d9:f7:c0)
    Source: LiteonTe_6c:14:2d (3c:a0:67:6c:14:2d)
    Type: IPv4 (0x0800)
Internet Protocol Version 4, Src: 10.150.33.173, Dst: 162.125.82.6
    0100 .... = Version: 4
    .... 0101 = Header Length: 20 bytes (5)
    Differentiated Services Field: 0x00 (DSCP: CS0, ECN: Not-ECT)
    Total Length: 52
    Identification: 0xcc5b (52315)
    Flags: 0x4000, Don't fragment
    ...0 0000 0000 0000 = Fragment offset: 0
    Time to live: 64
    Protocol: TCP (6)
    Header checksum: 0x4da2 [validation disabled]
    [Header checksum status: Unverified]
    Source: 10.150.33.173
    Destination: 162.125.82.6
Transmission Control Protocol, Src Port: 34946, Dst Port: 443, Seq: 1, Ack: 1, Len: 0

No.     Time           Source                Destination           Protocol Length Info
    793 11.836594482   10.150.33.173         162.125.82.6          TLSv1.2  583    Client Hello

Frame 793: 583 bytes on wire (4664 bits), 583 bytes captured (4664 bits) on interface 0
Ethernet II, Src: LiteonTe_6c:14:2d (3c:a0:67:6c:14:2d), Dst: Cisco_d9:f7:c0 (00:25:b4:d9:f7:c0)
    Destination: Cisco_d9:f7:c0 (00:25:b4:d9:f7:c0)
    Source: LiteonTe_6c:14:2d (3c:a0:67:6c:14:2d)
    Type: IPv4 (0x0800)
Internet Protocol Version 4, Src: 10.150.33.173, Dst: 162.125.82.6
    0100 .... = Version: 4
    .... 0101 = Header Length: 20 bytes (5)
    Differentiated Services Field: 0x00 (DSCP: CS0, ECN: Not-ECT)
    Total Length: 569
    Identification: 0xcc5c (52316)
    Flags: 0x4000, Don't fragment
    ...0 0000 0000 0000 = Fragment offset: 0
    Time to live: 64
    Protocol: TCP (6)
    Header checksum: 0x4b9c [validation disabled]
    [Header checksum status: Unverified]
    Source: 10.150.33.173
    Destination: 162.125.82.6
Transmission Control Protocol, Src Port: 34946, Dst Port: 443, Seq: 1, Ack: 1, Len: 517
Transport Layer Security

No.     Time           Source                Destination           Protocol Length Info
    794 11.840163795   162.125.82.6          10.150.33.173         TCP      66     443 → 34946 [ACK] Seq=1 Ack=518 Win=19456 Len=0 TSval=128736193 TSecr=1999419199

Frame 794: 66 bytes on wire (528 bits), 66 bytes captured (528 bits) on interface 0
Ethernet II, Src: Cisco_d9:f7:c0 (00:25:b4:d9:f7:c0), Dst: LiteonTe_6c:14:2d (3c:a0:67:6c:14:2d)
    Destination: LiteonTe_6c:14:2d (3c:a0:67:6c:14:2d)
    Source: Cisco_d9:f7:c0 (00:25:b4:d9:f7:c0)
    Type: IPv4 (0x0800)
Internet Protocol Version 4, Src: 162.125.82.6, Dst: 10.150.33.173
    0100 .... = Version: 4
    .... 0101 = Header Length: 20 bytes (5)
    Differentiated Services Field: 0x00 (DSCP: CS0, ECN: Not-ECT)
    Total Length: 52
    Identification: 0xe7ba (59322)
    Flags: 0x0000
    ...0 0000 0000 0000 = Fragment offset: 0
    Time to live: 63
    Protocol: TCP (6)
    Header checksum: 0x7343 [validation disabled]
    [Header checksum status: Unverified]
    Source: 162.125.82.6
    Destination: 10.150.33.173
Transmission Control Protocol, Src Port: 443, Dst Port: 34946, Seq: 1, Ack: 518, Len: 0

No.     Time           Source                Destination           Protocol Length Info
    884 12.789673326   162.125.82.6          10.150.33.173         TLSv1.2  1450   Server Hello

Frame 884: 1450 bytes on wire (11600 bits), 1450 bytes captured (11600 bits) on interface 0
Ethernet II, Src: Cisco_d9:f7:c0 (00:25:b4:d9:f7:c0), Dst: LiteonTe_6c:14:2d (3c:a0:67:6c:14:2d)
    Destination: LiteonTe_6c:14:2d (3c:a0:67:6c:14:2d)
    Source: Cisco_d9:f7:c0 (00:25:b4:d9:f7:c0)
    Type: IPv4 (0x0800)
Internet Protocol Version 4, Src: 162.125.82.6, Dst: 10.150.33.173
    0100 .... = Version: 4
    .... 0101 = Header Length: 20 bytes (5)
    Differentiated Services Field: 0x00 (DSCP: CS0, ECN: Not-ECT)
    Total Length: 1436
    Identification: 0xe7be (59326)
    Flags: 0x0000
    ...0 0000 0000 0000 = Fragment offset: 0
    Time to live: 63
    Protocol: TCP (6)
    Header checksum: 0x6dd7 [validation disabled]
    [Header checksum status: Unverified]
    Source: 162.125.82.6
    Destination: 10.150.33.173
Transmission Control Protocol, Src Port: 443, Dst Port: 34946, Seq: 1, Ack: 518, Len: 1384
Transport Layer Security

No.     Time           Source                Destination           Protocol Length Info
    885 12.789739059   10.150.33.173         162.125.82.6          TCP      66     34946 → 443 [ACK] Seq=518 Ack=1385 Win=64128 Len=0 TSval=1999420153 TSecr=128736288

Frame 885: 66 bytes on wire (528 bits), 66 bytes captured (528 bits) on interface 0
Ethernet II, Src: LiteonTe_6c:14:2d (3c:a0:67:6c:14:2d), Dst: Cisco_d9:f7:c0 (00:25:b4:d9:f7:c0)
    Destination: Cisco_d9:f7:c0 (00:25:b4:d9:f7:c0)
    Source: LiteonTe_6c:14:2d (3c:a0:67:6c:14:2d)
    Type: IPv4 (0x0800)
Internet Protocol Version 4, Src: 10.150.33.173, Dst: 162.125.82.6
    0100 .... = Version: 4
    .... 0101 = Header Length: 20 bytes (5)
    Differentiated Services Field: 0x00 (DSCP: CS0, ECN: Not-ECT)
    Total Length: 52
    Identification: 0xcc5d (52317)
    Flags: 0x4000, Don't fragment
    ...0 0000 0000 0000 = Fragment offset: 0
    Time to live: 64
    Protocol: TCP (6)
    Header checksum: 0x4da0 [validation disabled]
    [Header checksum status: Unverified]
    Source: 10.150.33.173
    Destination: 162.125.82.6
Transmission Control Protocol, Src Port: 34946, Dst Port: 443, Seq: 518, Ack: 1385, Len: 0

No.     Time           Source                Destination           Protocol Length Info
